{
  "evidence_id": "EV-003-memory-system",
  "task_id": "TASK-008",
  "feature_id": "006-persistent-agent-memory",
  "runner_agent": "tester",
  "command": "npm run test:memory",
  "exit_code": 0,
  "status": "passed",
  "summary": "Verificación del sistema de memoria persistente: 7 entradas modulares auditadas sin violaciones",
  "log_artifact": "MEMORY.md",
  "timestamp": "2026-10-01T08:05:00.000Z"
}
